{
  "schemaVersion": 2,
  "course": "html-css-js",
  "module": "dom-tooling-and-async",
  "files": [
    {
      "path": "workflow/catalog/html-css-js/dom-tooling-and-async/async-and-await/topic.json",
      "sha256": "07f0de13986e3e89c72528cbce7cedc34308027bd8f5d7d14a040ecb7509d74d",
      "bytes": 3261
    },
    {
      "path": "workflow/catalog/html-css-js/dom-tooling-and-async/debugging-with-devtools-breakpoints/topic.json",
      "sha256": "b68ea63d211db4d38c0db48662613f63e6e27ff7e0f31b48f2933766ebc6d10e",
      "bytes": 3789
    },
    {
      "path": "workflow/catalog/html-css-js/dom-tooling-and-async/events-and-event-bubbling/topic.json",
      "sha256": "d410158dccd1614090184d04f868afec9a27de1a6fee2dd0b3a38c783b08a3e9",
      "bytes": 3368
    },
    {
      "path": "workflow/catalog/html-css-js/dom-tooling-and-async/module.json",
      "sha256": "23b51a5a9ebb74e47a4f6a72063d01aa91ec6e9b49ca71972732966ec5b725cd",
      "bytes": 2249
    },
    {
      "path": "workflow/catalog/html-css-js/dom-tooling-and-async/preventing-cross-site-scripting/topic.json",
      "sha256": "cde7cb10e251e9ce18aefd9326b11ba47dffe0f32058a5a49ab921b0974ca449",
      "bytes": 3405
    },
    {
      "path": "workflow/catalog/html-css-js/dom-tooling-and-async/project-setup-with-npm-and-vite/topic.json",
      "sha256": "47b51a07b56ea503047ddfa0a73b23ceabf651fe6b0ce0e081ddf0082eda7979",
      "bytes": 3904
    },
    {
      "path": "workflow/catalog/html-css-js/dom-tooling-and-async/promises/topic.json",
      "sha256": "6dfded8e595831aacdfe2c784dad77ca53bf27a08bf1b936a193f0d6d4d53d06",
      "bytes": 3350
    },
    {
      "path": "workflow/catalog/html-css-js/dom-tooling-and-async/selecting-and-changing-the-dom/topic.json",
      "sha256": "de0b3f3ff08b86d42776eed58af5afcd84832f21943a4512f364d379439a0dba",
      "bytes": 3435
    },
    {
      "path": "workflow/catalog/html-css-js/dom-tooling-and-async/the-event-loop/topic.json",
      "sha256": "e4bb7c4c4d268b1360ce2a0497efa0438fefe30b23f33faab26c8736c05d26df",
      "bytes": 3269
    }
  ],
  "evidenceBindings": []
}
