{
  "schemaVersion": 2,
  "course": "python",
  "module": "fastapi-services",
  "files": [
    {
      "path": "workflow/catalog/python/fastapi-services/calling-the-spring-boot-api-from-fastapi-service-url-token-and-timeouts/topic.json",
      "sha256": "645220980339d110c0e9fd74d9f02a4e9c876894d48880af5426d86b038e6707",
      "bytes": 3968
    },
    {
      "path": "workflow/catalog/python/fastapi-services/fastapi-routes/topic.json",
      "sha256": "b73e72f7b4338731b91ab9a48a5b202e67ac3a1500d2529e376532497ebfc8fb",
      "bytes": 3608
    },
    {
      "path": "workflow/catalog/python/fastapi-services/module.json",
      "sha256": "c8df125ded59fb25f6006fcd73c5aaba50157bc72ab613f8995322c1ceb91530",
      "bytes": 1306
    },
    {
      "path": "workflow/catalog/python/fastapi-services/python-review/topic.json",
      "sha256": "b11627ef0e7acc4aa6142810d46b8cb8e6caa85ddf16665bc2de5719a5f85b5d",
      "bytes": 3098
    },
    {
      "path": "workflow/catalog/python/fastapi-services/serving-pipeline-results-as-an-api/topic.json",
      "sha256": "3441caf34e2f9a54b5000afef608431cce3f5e5cf63c548b69843c940cb9b848",
      "bytes": 3661
    }
  ],
  "evidenceBindings": []
}
