{
  "schemaVersion": 2,
  "course": "java-foundations",
  "module": "inheritance-and-design",
  "files": [
    {
      "path": "workflow/catalog/java-foundations/inheritance-and-design/abstract-classes/topic.json",
      "sha256": "30a4ed8f353a3866884377ea9f3ec8ef624864fc31beb7e4d25a388b7deb43a9",
      "bytes": 3023
    },
    {
      "path": "workflow/catalog/java-foundations/inheritance-and-design/composition-over-inheritance/topic.json",
      "sha256": "75a6f368b0920d6fb762aafb344c9ffb7aba832eb062a967876b7925d7110bcb",
      "bytes": 3282
    },
    {
      "path": "workflow/catalog/java-foundations/inheritance-and-design/functional-interfaces-and-anonymous-classes/topic.json",
      "sha256": "6ea8c6883e761f8f327cd01eb92aed18a695e6f11655372c6a0454176d36ab39",
      "bytes": 3070
    },
    {
      "path": "workflow/catalog/java-foundations/inheritance-and-design/inheritance/topic.json",
      "sha256": "b5830ffa87e4719b7013e61efc37607bb37b41f0edd0e52ad83508cb3254cf5a",
      "bytes": 3045
    },
    {
      "path": "workflow/catalog/java-foundations/inheritance-and-design/interfaces-and-default-methods/topic.json",
      "sha256": "561bdf9a850a7597862b024b980e85d7e0d38429853ecc0cfe7782661df5d92b",
      "bytes": 3027
    },
    {
      "path": "workflow/catalog/java-foundations/inheritance-and-design/module.json",
      "sha256": "df8980221594c39f6db126e20e9008ed74079a05c3381214441accbb23afa8d6",
      "bytes": 1354
    },
    {
      "path": "workflow/catalog/java-foundations/inheritance-and-design/polymorphism-overriding-vs-overloading/topic.json",
      "sha256": "2a4c96c53cea7b784b1fccd30c7632ebda9da7c84ca0b5ed13fe760d021cc0ef",
      "bytes": 3149
    },
    {
      "path": "workflow/catalog/java-foundations/inheritance-and-design/records/topic.json",
      "sha256": "6d8d98a4fcdc3b2f24a759e666f48b755f0e405792f552095c5f9d9a2984152a",
      "bytes": 3088
    },
    {
      "path": "workflow/catalog/java-foundations/inheritance-and-design/singleton-and-factory-patterns/topic.json",
      "sha256": "4e20ac62ea8d240e3fa73ddef39ce1bf3653da348ee323f536ff73b684777f45",
      "bytes": 3293
    },
    {
      "path": "workflow/catalog/java-foundations/inheritance-and-design/solid-basics/topic.json",
      "sha256": "ed1dc816419246ef8e77e2e1685a6318c5c8a0a4ddb0cff8836fde297882c220",
      "bytes": 3242
    }
  ],
  "evidenceBindings": []
}
